{
  "$schema": "./supabase-consumer-manifest.v3.schema.json",
  "schema": "tiangong.supabase-consumer-manifest.v3",
  "version": 3,
  "repository": {
    "slug": "tiangong-lca/data-foundry",
    "canonicalOrigin": "git@github.com:tiangong-lca/data-foundry.git"
  },
  "manifestSchema": {
    "path": "contracts/supabase-consumer-manifest.v3.schema.json",
    "sha256": "636dcaea54d60d5a04e898b18dd66e6f4ad934a6f14e26c6cabf70ec854a0812"
  },
  "sourceSnapshot": {
    "derivation": "prettier-babel-ast+structured-json-env-v3",
    "sourceTreeCommit": "c3c74555b71e1ba33ee80a5c5919630a27ba79df",
    "filteredGitTreeSha256": "104205dc44a03577d5d7d358b7fb60d09d999815a2ac55eaf86f13e521dae7b4",
    "pathPatterns": [
      ".agents/skills/**/*.md",
      ".env.example",
      "package.json",
      "scripts/**/*.mjs",
      "specs/**/*.json"
    ],
    "exactExemptions": ["scripts/audit-supabase-consumers.mjs"],
    "governedFileCount": 110,
    "symlinkPolicy": "reject",
    "nonRegularFilePolicy": "reject",
    "setEquality": "bidirectional-global-exactly-once"
  },
  "delivery": {
    "targetBranch": "main",
    "deliveryCommit": null,
    "deliveryCommitAuthority": "external-verifier-binds-actual-head",
    "headResolution": "scan-actual-git-head",
    "filteredGitTreeSha256": "104205dc44a03577d5d7d358b7fb60d09d999815a2ac55eaf86f13e521dae7b4",
    "governedSourcePolicy": "exact-tree-entries-equal-except-audit-tool"
  },
  "authority": {
    "status": "candidate",
    "authorizesConsumerZero": false,
    "authorizesDatabaseFreeze": false,
    "authorizesDatabaseMigration": false,
    "authorizesHostedMutation": false,
    "authorizesProductionMutation": false
  },
  "occurrences": [
    {
      "id": "occ-74ab4234d61e7a7dca73ad8c",
      "file": ".env.example",
      "line": 19,
      "span": {
        "startOffset": 946,
        "endOffset": 1025,
        "sha256": "64a8c5bb0a8e2800bf1dd70826f69c7de850ca1b3512f20c49243122c3fd3211"
      },
      "detector": "structured-env-parser",
      "capability": "foundry.env.tiangong_lca_api_base_url",
      "relationship": "configuration",
      "upstream": "supabase-platform",
      "transport": "endpoint-config",
      "credential": "none",
      "role": "foundry-task-actor",
      "schema": "platform",
      "object": "TIANGONG_LCA_API_BASE_URL",
      "signature": "TIANGONG_LCA_API_BASE_URL=<runtime-profile-value>",
      "acl": "example/public configuration only; secrets remain ignored runtime state",
      "semantics": "runtime-profile-configuration",
      "sourceClass": "versioned-config"
    },
    {
      "id": "occ-746d132daaa5b871989669eb",
      "file": ".env.example",
      "line": 20,
      "span": {
        "startOffset": 1026,
        "endOffset": 1047,
        "sha256": "f4f3c86ef2eaa4c518269aff51817ff36ccbd64f31180a6375e2dc8d9b379895"
      },
      "detector": "structured-env-parser",
      "capability": "foundry.env.tiangong_lca_api_key",
      "relationship": "configuration",
      "upstream": "foundry-account-profile",
      "transport": "credential-config",
      "credential": "encoded-user-credentials",
      "role": "foundry-task-actor",
      "schema": "platform",
      "object": "TIANGONG_LCA_API_KEY",
      "signature": "TIANGONG_LCA_API_KEY=<runtime-profile-value>",
      "acl": "example/public configuration only; secrets remain ignored runtime state",
      "semantics": "runtime-profile-configuration",
      "sourceClass": "versioned-config"
    },
    {
      "id": "occ-a0ded3b3e6cf4d91d45aed85",
      "file": ".env.example",
      "line": 22,
      "span": {
        "startOffset": 1078,
        "endOffset": 1162,
        "sha256": "bf804893d11e82ab12be448b80eb815753b084e8d13d78a4f7a47a7b4090f05b"
      },
      "detector": "structured-env-parser",
      "capability": "foundry.env.tiangong_lca_supabase_publishable_key",
      "relationship": "configuration",
      "upstream": "supabase-platform",
      "transport": "credential-config",
      "credential": "publishable-key",
      "role": "foundry-task-actor",
      "schema": "platform",
      "object": "TIANGONG_LCA_SUPABASE_PUBLISHABLE_KEY",
      "signature": "TIANGONG_LCA_SUPABASE_PUBLISHABLE_KEY=<runtime-profile-value>",
      "acl": "example/public configuration only; secrets remain ignored runtime state",
      "semantics": "runtime-profile-configuration",
      "sourceClass": "versioned-config"
    },
    {
      "id": "occ-0bc73b3d5088551c737bf3d5",
      "file": "scripts/commands/bafu-batch-import-run.mjs",
      "line": 840,
      "span": {
        "startOffset": 29391,
        "endOffset": 29452,
        "sha256": "044fed39fe2a23498491381ef945293193e31d2737fb864e5eeb4240b65c477a"
      },
      "detector": "javascript-ast-child-process",
      "capability": "runtime.subprocess.dispatch",
      "relationship": "indirect-upstream",
      "upstream": "runtime-selected-command",
      "transport": "subprocess",
      "credential": "inherited-process-environment",
      "role": "caller-runtime",
      "schema": "indirect-control-plane",
      "object": "command",
      "signature": "spawn(command, { cwd: repoRoot, env: childEnv, shell: true })",
      "acl": "inherits the Foundry process environment; downstream owner remains authoritative",
      "semantics": "spawn",
      "sourceClass": "runtime"
    },
    {
      "id": "occ-ceadb2d016e40fef4fd64144",
      "file": "scripts/commands/bafu-batch-import-run.mjs",
      "line": 841,
      "span": {
        "startOffset": 29461,
        "endOffset": 29530,
        "sha256": "7e6e819136df5112b3948e723c55146ccacca6b78cd233879df497b3d0f1e261"
      },
      "detector": "javascript-ast-child-process",
      "capability": "runtime.subprocess.dispatch",
      "relationship": "indirect-upstream",
      "upstream": "runtime-selected-command",
      "transport": "subprocess",
      "credential": "inherited-process-environment",
      "role": "caller-runtime",
      "schema": "indirect-control-plane",
      "object": "command[0]",
      "signature": "spawn(command[0], command.slice(1), { cwd: repoRoot, env: childEnv })",
      "acl": "inherits the Foundry process environment; downstream owner remains authoritative",
      "semantics": "spawn",
      "sourceClass": "runtime"
    },
    {
      "id": "occ-71a90d2cb96c8a4624641d57",
      "file": "scripts/commands/bafu-process-scope-e2e.mjs",
      "line": 320,
      "span": {
        "startOffset": 9708,
        "endOffset": 9803,
        "sha256": "ff2f5f4d3b3db89e1859ab3a1f610d8d2177adcb17a2f7cd205b33e8fed5b22a"
      },
      "detector": "javascript-ast-child-process",
      "capability": "runtime.subprocess.dispatch",
      "relationship": "indirect-upstream",
      "upstream": "runtime-selected-command",
      "transport": "subprocess",
      "credential": "inherited-process-environment",
      "role": "caller-runtime",
      "schema": "indirect-control-plane",
      "object": "command",
      "signature": "spawnSync(command, {\n    cwd,\n    env: process.env,\n    encoding: \"utf8\",\n    shell: true,\n  })",
      "acl": "inherits the Foundry process environment; downstream owner remains authoritative",
      "semantics": "spawnSync",
      "sourceClass": "runtime"
    },
    {
      "id": "occ-f932f17861f873bc55436258",
      "file": "scripts/commands/bafu-process-scope-e2e.mjs",
      "line": 401,
      "span": {
        "startOffset": 12254,
        "endOffset": 12357,
        "sha256": "fa415096af662f442dd7968ed79b1c1001882d9f731dc14d8e6f3f388fb4d753"
      },
      "detector": "javascript-ast-child-process",
      "capability": "tiangong-cli.dispatch",
      "relationship": "indirect-upstream",
      "upstream": "tiangong-lca/tiangong-cli",
      "transport": "subprocess",
      "credential": "inherited-process-environment",
      "role": "caller-runtime",
      "schema": "indirect-control-plane",
      "object": "argv[0]",
      "signature": "spawnSync(argv[0], argv.slice(1), {\n    cwd: repoRoot,\n    env: process.env,\n    encoding: \"utf8\",\n  })",
      "acl": "inherits the Foundry process environment; downstream owner remains authoritative",
      "semantics": "spawnSync",
      "sourceClass": "runtime"
    },
    {
      "id": "occ-870b4eff7c12ebfb6b779dd0",
      "file": "scripts/commands/bafu-process-scope-e2e.mjs",
      "line": 1615,
      "span": {
        "startOffset": 53704,
        "endOffset": 53829,
        "sha256": "d4b135ee70f639d5acdadfc4802f372d3e954885b5c404041ab7dcf04b6b3c0c"
      },
      "detector": "javascript-ast-child-process",
      "capability": "tiangong-cli.dispatch",
      "relationship": "indirect-upstream",
      "upstream": "tiangong-lca/tiangong-cli",
      "transport": "subprocess",
      "credential": "inherited-process-environment",
      "role": "caller-runtime",
      "schema": "indirect-control-plane",
      "object": "finalizeCommand[0]",
      "signature": "spawnSync(finalizeCommand[0], finalizeCommand.slice(1), {\n    cwd: repoRoot,\n    env: process.env,\n    encoding: \"utf8\",\n  })",
      "acl": "inherits the Foundry process environment; downstream owner remains authoritative",
      "semantics": "spawnSync",
      "sourceClass": "runtime"
    },
    {
      "id": "occ-05ceccf01cbfe622695ae4de",
      "file": "scripts/commands/bafu-process-scope-e2e.mjs",
      "line": 1728,
      "span": {
        "startOffset": 58005,
        "endOffset": 58154,
        "sha256": "1186892232770ea7b25c31d598e2308587cad208b118da5e5ab1832ff2f34811"
      },
      "detector": "javascript-ast-child-process",
      "capability": "tiangong-cli.dispatch",
      "relationship": "indirect-upstream",
      "upstream": "tiangong-lca/tiangong-cli",
      "transport": "subprocess",
      "credential": "inherited-process-environment",
      "role": "caller-runtime",
      "schema": "indirect-control-plane",
      "object": "finalizeCommand[0]",